{
  "$schema": "https://vomaste.cz/schemas/canonical/source.schema.json",
  "schemaVersion": 1,
  "@context": "https://vomaste.cz/context/v1.jsonld",
  "@id": "https://vomaste.cz/id/dossiers/robert-plaga/sources/SRC-29",
  "@type": "vomaste:Source",
  "recordType": "source",
  "identifier": "SRC-29",
  "dossier": {
    "@id": "https://vomaste.cz/id/dossiers/robert-plaga"
  },
  "title": "SRC-29 — Deník.cz (VLTAVA LABE MEDIA)",
  "outlet": "Deník.cz (VLTAVA LABE MEDIA)",
  "sourceType": "zpravodajství",
  "url": "https://www.denik.cz/skolstvi-a-vzdelavani/zakaz-mobilu-ve-skolach-cesko-opozice-zakon-ministr-robert-plaga/",
  "published": "2026-03-02",
  "retrieved": "2026-07-30",
  "claims": [
    {
      "@id": "https://vomaste.cz/id/dossiers/robert-plaga/claims/CLM-45"
    }
  ],
  "subjects": [
    "plaga"
  ],
  "content": [
    {
      "type": "markdown",
      "value": "**Zákaz mobilů ve školách: Opozice navrhla vlastní zákon, Plaga se radí s experty**\n\nPoslanci KDU-ČSL navrhli vlastní novelu školského zákona: úplný zákaz pro děti do 10 let, pro děti do 15 let použití jen na pokyn učitele, rozsah od MŠ po SŠ včetně ZUŠ, účinnost od 1. 7. 2026, výjimky pro žáky se zdravotními omezeními. Poslanec Václav Pláteník návrh vysvětluje. Mluvčí MŠMT Ondřej Macura uvádí, že o případném zákazu nebylo tehdy rozhodnuto a ministr věc řeší s odborníky; ministerstvo připravovalo metodiku dobré praxe.\n\nZdroj otevřen a přečten 2026-07-30. Dokládá znění citovaného zpravodajství k datu otevření, ne nezávislé potvrzení jinými zdroji."
    }
  ],
  "order": 29
}
