{
  "$schema": "https://vomaste.cz/schemas/canonical/source.schema.json",
  "schemaVersion": 1,
  "@context": "https://vomaste.cz/context/v1.jsonld",
  "@id": "https://vomaste.cz/id/dossiers/tomas-petricek/sources/SRC-01",
  "@type": "vomaste:Source",
  "recordType": "source",
  "identifier": "SRC-01",
  "dossier": {
    "@id": "https://vomaste.cz/id/dossiers/tomas-petricek"
  },
  "title": "SRC-01 — Vláda ČR (oficiální profil člena vlády)",
  "description": "Oficiální vládní profil: ministr zahraničních věcí 16. 10. 2018 – 12. 4. 2021.",
  "outlet": "Vláda České republiky (vlada.gov.cz)",
  "sourceType": "oficiální primární zdroj",
  "url": "https://vlada.gov.cz/cz/clenove-vlady/tomas-petricek-167018/",
  "retrieved": "2026-08-08",
  "claims": [
    {
      "@id": "https://vomaste.cz/id/dossiers/tomas-petricek/claims/CLM-01"
    }
  ],
  "subjects": [
    "tomas-petricek"
  ],
  "content": [
    {
      "type": "markdown",
      "value": "Oficiální profil člena vlády na webu Vlády ČR, otevřen a přečten 2026-08-08.\nUvádí funkci ministra zahraničních věcí od 16. 10. 2018 do 12. 4. 2021, dřívější funkci náměstka ministryně práce a sociálních věcí (květen–prosinec 2017) a působení poradce v Evropském parlamentu.\n\nPoznámka k typu zdroje a jeho limitům: **primární úřední záznam** — dokládá výkon vládní funkce a její data; okolnosti odvolání dokládá SRC-02."
    }
  ],
  "order": 1
}
