{
  "$schema": "https://vomaste.cz/schemas/canonical/source.schema.json",
  "schemaVersion": 1,
  "@context": "https://vomaste.cz/context/v1.jsonld",
  "@id": "https://vomaste.cz/id/dossiers/petr-fiala/sources/SRC-04",
  "@type": "vomaste:Source",
  "recordType": "source",
  "identifier": "SRC-04",
  "dossier": {
    "@id": "https://vomaste.cz/id/dossiers/petr-fiala"
  },
  "title": "SRC-04 — RESPEKT: Jaký premiér byl Petr Fiala (velká anketa)",
  "description": "Anketa týdeníku RESPEKT, ve které patnáct jmenovaných osobností hodnotí čtyřleté premiérské období Petra Fialy.",
  "outlet": "Respekt",
  "sourceFamily": "respekt",
  "sourceType": "názor / komentář (anketa)",
  "url": "https://www.respekt.cz/cesko/sidlo-halik-hulova-a-dalsi-velka-anketa-jaky-premier-byl-petr-fiala",
  "published": "2025-09-12",
  "retrieved": "2026-08-07",
  "claims": [
    {
      "@id": "https://vomaste.cz/id/dossiers/petr-fiala/claims/CLM-03"
    }
  ],
  "subjects": [
    "petr-fiala"
  ],
  "content": [
    {
      "type": "markdown",
      "value": "Anketa RESPEKTu, otevřena a přečtena 2026-08-07.\nPatnáct jmenovaných přispěvatelů hodnotí Fialovo premiérské období 2021–2025: Jindřich Šídlo (komentátor) oceňuje podporu Ukrajině a stabilitu vládnutí; Apolena Rychlíková (Pagenotfound.cz) jej popisuje jako odtrženého od reálných problémů občanů; Josef Středula (ČMKOS) chválí zahraniční politiku, kritizuje nedostatečný sociální dialog; Zuzana Szabó Lenhartová (Hnutí DUHA) mluví o „promarněných nadějích“ v ochraně životního prostředí; Petros Michopulos hodnotí mandát mimo zahraniční politiku jako „šlapání vody“; Michal Stehlík vyzdvihuje politickou zručnost při řízení pětikoaliční vlády; Petra Hůlová kritizuje ideologii ODS; Ivan Pilný (bývalý ministr financí za ANO) mluví o „promarněné příležitosti“ bez reformní vize; Ivan Gabal chválí reakci na válku na Ukrajině, kritizuje váhavost v domácích reformách; Johana Nejedlová (Konsent) upozorňuje na nenaplněné závazky v oblasti rovnosti; Tomáš Halík oceňuje charakter a proatlantickou orientaci; Otto Eibl vyzdvihuje slušnost a konzistenci; Jana Matesová chválí bezpečnostní politiku a fiskální konsolidaci; Martin Groman poznamenává nesoulad profesorského image s dobou sociálních sítí; Šárka Homfray kritizuje rozpor mezi rétorikou a konkrétními politickými kroky.\n\nPoznámka k typu zdroje a jeho limitům: explicitně **názorový/komentářový žánr** — souhrn subjektivních hodnocení jmenovaných osobností, nikoli redakční zjištění faktu. Vedeno na stránce jako NÁZOR, striktně odděleně od faktografických tvrzení; žádné z uvedených hodnocení není přebíráno jako vlastní závěr tohoto webu."
    }
  ],
  "order": 4
}
