{
  "$schema": "https://vomaste.cz/schemas/canonical/source.schema.json",
  "schemaVersion": 1,
  "@context": "https://vomaste.cz/context/v1.jsonld",
  "@id": "https://vomaste.cz/id/dossiers/frantisek-konicek/sources/SRC-01",
  "@type": "vomaste:Source",
  "recordType": "source",
  "identifier": "SRC-01",
  "dossier": {
    "@id": "https://vomaste.cz/id/dossiers/frantisek-konicek"
  },
  "title": "SRC-01 — Vláda ČR (oficiální přehled členů vlády Jiřího Rusnoka)",
  "description": "Oficiální přehled členů vlády Jiřího Rusnoka: František Koníček ministrem práce a sociálních věcí 10. 7. 2013 – 29. 1. 2014.",
  "outlet": "Vláda České republiky (vlada.gov.cz)",
  "sourceType": "oficiální primární zdroj",
  "url": "https://vlada.gov.cz/cz/clenove-vlady/historie-minulych-vlad/prehled-vlad-cr/1993-2013-cr/jiri-rusnok/prehled-clenu-vlady-jiriho-rusnoka-13-07-2013---29-01-2014-115419/",
  "retrieved": "2026-08-08",
  "claims": [
    {
      "@id": "https://vomaste.cz/id/dossiers/frantisek-konicek/claims/CLM-01"
    }
  ],
  "subjects": [
    "frantisek-konicek"
  ],
  "content": [
    {
      "type": "markdown",
      "value": "Oficiální přehled členů vlády Jiřího Rusnoka na webu Vlády ČR, otevřen a přečten 2026-08-08.\nUvádí, že František Koníček byl ministrem práce a sociálních věcí od 10. 7. 2013 do 13. 8. 2013 a poté v demisi od 13. 8. 2013 do 29. 1. 2014.\n\nPoznámka k typu zdroje a jeho limitům: **primární úřední záznam** — jediný přímo otevřený zdroj tohoto dossieru; tvrzení proto nese stav 1 ZDROJ a dřívější či pozdější funkce se bez otevřeného zdroje neuvádějí."
    }
  ],
  "order": 1
}
