{
  "$schema": "https://vomaste.cz/schemas/canonical/source.schema.json",
  "schemaVersion": 1,
  "@context": "https://vomaste.cz/context/v1.jsonld",
  "@id": "https://vomaste.cz/id/dossiers/bert-bartas/sources/SRC-03",
  "@type": "vomaste:Source",
  "recordType": "source",
  "identifier": "SRC-03",
  "dossier": {
    "@id": "https://vomaste.cz/id/dossiers/bert-bartas"
  },
  "title": "SRC-03 — ČT24: ANO ve Znojmě tvrdí, že koaliční zastupitel dostal nabídku úplatku",
  "description": "ČT24 (zdroj ČTK) o tvrzení hnutí ANO z července 2024 o nabídkách úplatků: zmínka Berta Bartase v tvrzení ANO o nabídkách.",
  "outlet": "ČT24 (Česká televize)",
  "sourceType": "zpravodajský článek",
  "url": "https://ct24.ceskatelevize.cz/clanek/regiony/ano-ve-znojme-tvrdi-ze-koalicni-zastupitel-dostal-nabidku-uplatku-351134",
  "retrieved": "2026-08-08",
  "published": "2024-07-15",
  "sourceFamily": "ctk",
  "claims": [
    {
      "@id": "https://vomaste.cz/id/dossiers/bert-bartas/claims/CLM-03"
    }
  ],
  "subjects": [
    "bert-bartas"
  ],
  "content": [
    {
      "type": "markdown",
      "value": "Článek ČT24 z 15. 7. 2024 (uvedený zdroj ČTK), otevřen a přečten 2026-08-08. Zaznamenává tvrzení hnutí ANO o nabídkách úplatků koaličním zastupitelům — jmenovitě Květoslavu Svobodovi (SPD), který nabídku potvrdil a odmítl, a Bertu Bartasovi (Znojmáci), který se odmítl vyjádřit.\n\nPoznámka k limitům: veškerá tvrzení o nabídkách úplatků jsou výhradně atribuovaná tvrzení stran sporu — nikdo nebyl obviněn, ČT24/ČTK je nepotvrzuje a tento web je nepřijímá za vlastní závěr (gate 4); z odmítnutí komentáře se nic nevyvozuje."
    }
  ],
  "order": 3
}
