{
  "$schema": "https://vomaste.cz/schemas/canonical/source.schema.json",
  "schemaVersion": 1,
  "@context": "https://vomaste.cz/context/v1.jsonld",
  "@id": "https://vomaste.cz/id/dossiers/karel-havlicek/sources/SRC-08",
  "@type": "vomaste:Source",
  "recordType": "source",
  "identifier": "SRC-08",
  "dossier": {
    "@id": "https://vomaste.cz/id/dossiers/karel-havlicek"
  },
  "title": "SRC-08 — Česká justice",
  "outlet": "Česká justice",
  "sourceType": "zpravodajství",
  "url": "https://www.ceska-justice.cz/2026/04/tisic-stran-zmen-a-tyden-na-reakci-stavebni-zakon/",
  "published": "2026-04-18",
  "retrieved": "2026-07-30",
  "claims": [
    {
      "@id": "https://vomaste.cz/id/dossiers/karel-havlicek/claims/CLM-11"
    },
    {
      "@id": "https://vomaste.cz/id/dossiers/karel-havlicek/claims/CLM-12"
    },
    {
      "@id": "https://vomaste.cz/id/dossiers/karel-havlicek/claims/CLM-13"
    },
    {
      "@id": "https://vomaste.cz/id/dossiers/karel-havlicek/claims/CLM-14"
    }
  ],
  "subjects": [
    "havlicek"
  ],
  "content": [
    {
      "type": "markdown",
      "value": "**Tisíc stran změn a týden na reakci. Vláda finišuje stavební zákon, opozice varuje: Je to paskvil**\n\nVláda předložila komplexní pozměňovací návrh o 1083 stranách formou poslaneckého návrhu bez připomínkového řízení, poslanci dostali zhruba týden; opozice a právníci postup ostře kritizují.\n\nZdroj otevřen a přečten 2026-07-30. Dokládá znění citovaného zpravodajství k datu otevření, ne nezávislé potvrzení jinými zdroji."
    }
  ],
  "order": 8
}
