{
  "$schema": "https://vomaste.cz/schemas/canonical/source.schema.json",
  "schemaVersion": 1,
  "@context": "https://vomaste.cz/context/v1.jsonld",
  "@id": "https://vomaste.cz/id/dossiers/martin-sebestyan/sources/SRC-41",
  "@type": "vomaste:Source",
  "recordType": "source",
  "identifier": "SRC-41",
  "dossier": {
    "@id": "https://vomaste.cz/id/dossiers/martin-sebestyan"
  },
  "title": "SRC-41 — Státní zemědělský intervenční fond",
  "description": "Tisková zpráva SZIF „SZIF zveřejňuje právní analýzy k otázce střetu zájmu“ z 23. dubna 2026",
  "outlet": "Státní zemědělský intervenční fond",
  "sourceType": "oficiální primární zdroj",
  "url": "https://szif.gov.cz/cs/CmDocument?rid=/apa_anon/cs/zpravy/zpravy_o_fondu/tiskove_zpravy/1776952188863.pdf",
  "published": "2026-04-23",
  "retrieved": "2026-08-06",
  "claims": [
    {
      "@id": "https://vomaste.cz/id/dossiers/martin-sebestyan/claims/CLM-51"
    }
  ],
  "subjects": [
    "sebestyan"
  ],
  "content": [
    {
      "type": "markdown",
      "value": "**SZIF zveřejňuje právní analýzy k otázce střetu zájmu (Praha, 23. dubna 2026)**\n\nTisková zpráva, kterou fond vydal v den zveřejnění posudků, mluví o analýzách „zpracovaných nezávislou externí advokátní kanceláří“ — v jednotném čísle — a k souhlasu se zveřejněním uvádí: „ke zveřejnění analýz má v současnosti výslovný souhlas od advokátní kanceláře PORTOS a dále Fond zjišťuje postoj od advokátní kanceláře Pelikán Krofta Kohoutek“. Zveřejnění fond odůvodňuje snahou „otevřeně a srozumitelně vysvětlit svá rozhodnutí a předejít spekulacím či nejasnostem“, a to i přesto, že posudky „obsahují právní posouzení vztahující se k probíhajícím správním řízením“.\n\n**Poznámka k přesnosti a limitům**: PDF staženo a přečteno celé (1 strana) dne 6. 8. 2026. Zpráva sama neuvádí počet zveřejněných analýz ani jejich názvy — počet a autorství jsou doložitelné až ze samotné sekce webu (SRC-40). Znění tiskové zprávy z 23. 4. 2026 a znění sekce webu ke dni 6. 8. 2026 se v otázce souhlasu druhé kanceláře liší; rozdíl je zaznamenán, nikoli vysvětlen."
    }
  ],
  "order": 41
}
