{
  "$schema": "https://vomaste.cz/schemas/canonical/source.schema.json",
  "schemaVersion": 1,
  "@context": "https://vomaste.cz/context/v1.jsonld",
  "@id": "https://vomaste.cz/id/dossiers/robert-plaga/sources/SRC-27",
  "@type": "vomaste:Source",
  "recordType": "source",
  "identifier": "SRC-27",
  "dossier": {
    "@id": "https://vomaste.cz/id/dossiers/robert-plaga"
  },
  "title": "SRC-27 — Novinky.cz",
  "description": "Mobily ve školách zakáže zákon",
  "outlet": "Novinky.cz",
  "sourceType": "zpravodajství",
  "url": "https://www.novinky.cz/clanek/domaci-mobily-ve-skolach-zakaze-zakon-40584234",
  "retrieved": "2026-07-30",
  "claims": [
    {
      "@id": "https://vomaste.cz/id/dossiers/robert-plaga/claims/CLM-36"
    },
    {
      "@id": "https://vomaste.cz/id/dossiers/robert-plaga/claims/CLM-43"
    },
    {
      "@id": "https://vomaste.cz/id/dossiers/robert-plaga/claims/CLM-44"
    }
  ],
  "subjects": [
    "plaga"
  ],
  "content": [
    {
      "type": "markdown",
      "value": "**Mobily ve školách zakáže zákon**\n\nŘeditel Národního ústavu duševního zdraví Jiří Horáček zákaz podporuje s odkazem na vliv sociálních sítí na duševní obtíže dětí; Kamil Kopecký považuje zákaz za zbytečný, protože ředitelé mohou telefony omezit už dnes; výzkumníci Masarykovy univerzity uvádějí, že zákazy nevedou k lepším výsledkům. Telefony mají být odkládány na určené místo, při porušení dočasně odebrány a vráceny nejpozději na konci vyučování.\n\nZdroj otevřen a přečten 2026-07-30. Dokládá znění citovaného zpravodajství k datu otevření, ne nezávislé potvrzení jinými zdroji."
    }
  ],
  "order": 27
}
