{
  "$schema": "https://vomaste.cz/schemas/canonical/source.schema.json",
  "schemaVersion": 1,
  "@context": "https://vomaste.cz/context/v1.jsonld",
  "@id": "https://vomaste.cz/id/dossiers/jeronym-tejc/sources/SRC-07",
  "@type": "vomaste:Source",
  "recordType": "source",
  "identifier": "SRC-07",
  "dossier": {
    "@id": "https://vomaste.cz/id/dossiers/jeronym-tejc"
  },
  "title": "SRC-07 — ČT24 (Česká televize)",
  "outlet": "ČT24 (Česká televize)",
  "sourceType": "zpravodajství",
  "url": "https://ct24.ceskatelevize.cz/clanek/domaci/v-kauze-otcem-usmrcene-divky-podal-tejc-vedle-karne-zaloby-i-podnet-vuci-ospod-375130",
  "published": "2026-07-01",
  "retrieved": "2026-07-30",
  "claims": [
    {
      "@id": "https://vomaste.cz/id/dossiers/jeronym-tejc/claims/CLM-08"
    },
    {
      "@id": "https://vomaste.cz/id/dossiers/jeronym-tejc/claims/CLM-09"
    },
    {
      "@id": "https://vomaste.cz/id/dossiers/jeronym-tejc/claims/CLM-10"
    },
    {
      "@id": "https://vomaste.cz/id/dossiers/jeronym-tejc/claims/CLM-11"
    },
    {
      "@id": "https://vomaste.cz/id/dossiers/jeronym-tejc/claims/CLM-12"
    }
  ],
  "subjects": [
    "tejc"
  ],
  "content": [
    {
      "type": "markdown",
      "value": "**V kauze otcem usmrcené dívky podal Tejc vedle kárné žaloby i podnět vůči OSPOD**\n\nMinistr Tejc podal kárnou žalobu na soudkyni benešovského okresního soudu a zaslal ministru práce podnět k prověření OSPOD. Navrhuje roční snížení platu soudkyně o 30 %. Vytýká jí, že se věci věnovala nedbale, rozhodla formálně a opomenula provést řadu dostupných důkazů. Citace: „Soudci jsou ve svém rozhodování nezávislí, ale nemají být nezávislí na zákonech.“\n\nZdroj otevřen a přečten 2026-07-30. Dokládá znění citovaného zpravodajství k datu otevření, ne nezávislé potvrzení jinými zdroji."
    }
  ],
  "order": 7
}
