{
  "$schema": "https://vomaste.cz/schemas/canonical/source.schema.json",
  "schemaVersion": 1,
  "@context": "https://vomaste.cz/context/v1.jsonld",
  "@id": "https://vomaste.cz/id/dossiers/james-quick/sources/SRC-18",
  "@type": "vomaste:Source",
  "recordType": "source",
  "identifier": "SRC-18",
  "dossier": {
    "@id": "https://vomaste.cz/id/dossiers/james-quick"
  },
  "title": "SRC-18 — iSport.cz (ČTK): Obžaloba proti Růžičkovi je hotová a míří k soudu",
  "description": "Zpráva ČTK přebraná iSport.cz o dokončené obžalobě na Vladimíra Růžičku pro dvojnásobnou zpronevěru a o tom, kdo trestní oznámení podal.",
  "outlet": "iSport.cz (Blesk)",
  "sourceType": "agenturní zpravodajství (ČTK)",
  "url": "https://isport.blesk.cz/clanek/hokej/268597/dvojnasobna-zpronevera-obzaloba-proti-ruzickovi-je-hotova-a-miri-k-soudu.html",
  "published": "2016-05-09",
  "retrieved": "2026-08-06",
  "claims": [
    {
      "@id": "https://vomaste.cz/id/dossiers/james-quick/claims/CLM-17"
    }
  ],
  "subjects": [
    "james-quick"
  ],
  "content": [
    {
      "type": "markdown",
      "value": "Agenturní zpráva ČTK, přímo otevřená a přečtená celá. Jmenuje dozorující státní zástupkyni a přesně cituje výši údajné škody i hrozící trest, a nezávisle na dossieru potvrzuje, že oznámení v této věci podal Jiří Jehlička. Zpráva výslovně uvádí, že obžaloba v době publikace ještě nebyla podána k soudu — jde o procesní mezikrok, ne rozhodnutí."
    }
  ],
  "order": 18
}
