{
  "$schema": "https://vomaste.cz/schemas/canonical/source.schema.json",
  "schemaVersion": 1,
  "@context": "https://vomaste.cz/context/v1.jsonld",
  "@id": "https://vomaste.cz/id/dossiers/martin-sebestyan/sources/SRC-36",
  "@type": "vomaste:Source",
  "recordType": "source",
  "identifier": "SRC-36",
  "dossier": {
    "@id": "https://vomaste.cz/id/dossiers/martin-sebestyan"
  },
  "title": "SRC-36 — Blesk.cz, 23. 4. 2026",
  "description": "Agrofert zpětně dotace vracet nemusí! SZIF kvůli spekulacím zveřejnil právní analýzy.",
  "outlet": "Blesk.cz",
  "sourceType": "zpravodajství",
  "url": "https://www.blesk.cz/clanek/zpravy-politika/838025/agrofert-zpetne-dotace-vracet-nemusi-szif-kvuli-spekulacim-zverejnil-pravni-analyzy.html",
  "published": "2026-04-23",
  "retrieved": "2026-08-03",
  "claims": [
    {
      "@id": "https://vomaste.cz/id/dossiers/martin-sebestyan/claims/CLM-51"
    }
  ],
  "subjects": [
    "sebestyan"
  ],
  "content": [
    {
      "type": "markdown",
      "value": "**Co dokládá.** SZIF 23. 4. 2026 zveřejnil na svém webu čtyři právní analýzy k dotacím Agrofertu — dvě od advokátní kanceláře PORTOS (s jejím výslovným souhlasem ke zveřejnění) a dvě od kanceláře Pelikán Krofta Kohoutek (fond si v tu chvíli teprve vyžadoval souhlas). Podle analýz nemusí Agrofert zpětně vracet nárokové evropské dotace z let 2017–2021 a může nadále čerpat dotace, jejichž vyplácení bylo dříve pozastaveno.\n\n**Proč je to tu důležité.** Odpovídá na [GAP-10](@/dossiers/martin-sebestyan/gaps/gap-10.md): analýzy nejsou (už) neveřejné — SZIF je sám zveřejnil, dohledatelné přímo na szif.gov.cz — a doplňuje jméno druhé advokátní kanceláře, které gap postrádal."
    }
  ],
  "order": 36
}
